Vimeo ID,Title,Description,Duration (min),Embed URL,Thumbnail URL,Tags,Categories,Provincie,Gemeente,Organizations,Views,Created Date
1124126449,"13. Haarlerberg. Struinpad Lang","",36,https://player.vimeo.com/video/1124126449?h=85c3f55ac2&title=0&byline=0&portrait=0&badge=0&autopause=0&player_id=0&app_id=58479,https://i.vimeocdn.com/video/2065900553-2799f36138424bd270cb3f2a060cf0bef4004e3411e3336eb94a5a61c65fccfe-d_1920x1080?&r=pad&region=us,"","",,,"",0,2025-10-03T07:07:48+00:00
1124122937,"Haarlerberg Struinpad en heide winter Natuurmonumenten","Een winterwandeling op de Haarlerberg. Van het struinpad, langs de schaapskooi naar boven de hei op. Het is lekker koud, je ziet het rijp op de heide. Wandel je mee? Dit is de korte versie van deze ro",23,https://player.vimeo.com/video/1124122937?h=9cd4c4801c&title=0&byline=0&portrait=0&badge=0&autopause=0&player_id=0&app_id=58479,https://i.vimeocdn.com/video/2065895088-7eb0fecda7f860676e499a3de75ea8b4b5a7f094ddf42277e941afa626046f79-d_1920x1080?&r=pad&region=us,"Natuurmonumenten, Haarlerberg, Gemeente Hellendoorn, Provincie Overijssel","",Overijssel,Hellendoorn,"Natuurmonumenten",0,2025-10-03T06:46:22+00:00
1123924727,"Lemelerberg winter met sneeuw","Hoe mooi is het om even ècht weer een sneeuwwandeling te maken? Nu kan het want vandaag heeft het gesneeuwd... Hoor je de stappen door de sneeuw? En dat op de Lemelerberg!",35,https://player.vimeo.com/video/1123924727?h=bbd393d11d&title=0&byline=0&portrait=0&badge=0&autopause=0&player_id=0&app_id=58479,https://i.vimeocdn.com/video/2065653917-a69b45ba0209a9fe6946094a297f6c988fac5e3366f50b21ebe3fff4a73f56bc-d_1920x1080?&r=pad&region=us,"winter, Lemelerberg, Gemeente Ommen, Provincie Overijssel","",Overijssel,Ommen,"",0,2025-10-02T14:54:52+00:00
1123922142,"Dalfsen Landgoed Rechteren kogelvanger winter","Een winterwandeling over Landgoed Rechteren. Het is nog wat douwig waardoor het soms een beetje mysterieus voelt... Kijk je mee?",13,https://player.vimeo.com/video/1123922142?h=6042ae1899&title=0&byline=0&portrait=0&badge=0&autopause=0&player_id=0&app_id=58479,https://i.vimeocdn.com/video/2065648382-57d9cec58fae6cd76d1227ce92db24043d2188e79ccee28e963b9cd0bc25944c-d_1920x1080?&r=pad&region=us,"eiken, vogels, bos, douw, Gemeente Dalfsen, Provincie Overijssel","",Overijssel,Dalfsen,"",0,2025-10-02T14:47:37+00:00
1123903816,"Gemeente Ommen Lemelerberg Zomeravond","Voel je dat de avond nadert? Het wordt soms al wat donkerder, maar als je goed kijkt zie je dat alle insecten nog druk zijn op en om de heide. Het heeft wel wat hè, die avond 'gloren'? We lopen naar h",19,https://player.vimeo.com/video/1123903816?h=d7d4d86903&title=0&byline=0&portrait=0&badge=0&autopause=0&player_id=0&app_id=58479,https://i.vimeocdn.com/video/2065631020-3d3c2b9a90a22dbe2f64faa3a826e37caaec3a9ef635b21a20ed54f227fd7d06-d_1920x1080?&r=pad&region=us,"zonsondergang, insecten, zomer, schaapskudde, schapen, Gemeente Ommen, Provincie Overijssel","",Overijssel,Ommen,"",0,2025-10-02T13:56:29+00:00
1123880769,"Ommen Landgoed Vilsteren","Een leuke herfstwandeling waarbij we starten bij de kerk en ons al snel in de mooie Vilsterse bossen bevinden. Dit is de korte versie van deze route.",20,https://player.vimeo.com/video/1123880769?h=d6c99c3ff4&title=0&byline=0&portrait=0&badge=0&autopause=0&player_id=0&app_id=58479,https://i.vimeocdn.com/video/2065597991-0e8a7fe28cb0916b7975b15c5046b4a6540bb847f6fbf1a9779d81eae60f65c0-d_1920x1080?&r=pad&region=us,"water, bos, ijsvogel, Vilsteren, Gemeente Ommen, Provincie Overijssel","",Overijssel,Ommen,"",0,2025-10-02T12:43:50+00:00
1123879604,"Ommen Landgoed Vilsteren herfst","Een herfstwandeling rondom Landgoed Vilsteren. De kerk, het bos en het water komen voorbij. Ook de ijsvogel is te horen in deze video.",0,https://player.vimeo.com/video/1123879604?h=2350fa9008&title=0&byline=0&portrait=0&badge=0&autopause=0&player_id=0&app_id=58479,https://i.vimeocdn.com/video/default-2308240_1920x1080?&region=us,"bos, water, ijsvogel, herfst, Gemeente Ommen, Provincie Overijssel","",Overijssel,Ommen,"",0,2025-10-02T12:39:38+00:00
1123866257,"Raalte Boetelerveld winter","Doe je laarzen maar aan want het is nat op het Boetelerveld. De koeien lopen lekker te grazen en er is ook nog een roofvogel die zich meldt. Het gras lijkt wel goud, geniet er van.",57,https://player.vimeo.com/video/1123866257?h=1a48452c1b&title=0&byline=0&portrait=0&badge=0&autopause=0&player_id=0&app_id=58479,https://i.vimeocdn.com/video/2065580514-8335f60313ebfb02baadf9e95444cfd98691067a98e991d4e7b7050829b439dc-d_1920x1080?&r=pad&region=us,"roofvogel, water, winter, gemeente Raalte, Provincie Overijssel","",Overijssel,Raalte,"",0,2025-10-02T11:47:39+00:00
1123865699,"Raalte Boetelerveld winter","Een mooie winterwandeling over het Boetelerveld. De koeien kijken nieuwsgierig mee. Maar er zijn nog meer dieren die zich melden. Doe je laarzen aan want het is nat!",24,https://player.vimeo.com/video/1123865699?h=ac602f44f0&title=0&byline=0&portrait=0&badge=0&autopause=0&player_id=0&app_id=58479,https://i.vimeocdn.com/video/2065579044-c07fdec1d68a534569aac2052645a51614c55a2b5b8fc45f55a2d66853f95836-d_1920x1080?&r=pad&region=us,"roofvogel, winter, Boetelerveld, Gemeente Raalte, Provincie Overijssel","",Overijssel,Raalte,"",0,2025-10-02T11:45:02+00:00
1123865018,"Ommen Steile Oever herfst","Een herfstwandeling door de bossen bij Ommen.",19,https://player.vimeo.com/video/1123865018?h=63edb1936e&title=0&byline=0&portrait=0&badge=0&autopause=0&player_id=0&app_id=58479,https://i.vimeocdn.com/video/2065578134-86efeff5aeee4224eb0a7b4314f1ba0e6ed87ff642a92842acfea1aa9fbad643-d_1920x1080?&r=pad&region=us,"brug, Vecht, water, Herfst, Gemeente Ommen, Provincie Overijssel","",Overijssel,Ommen,"",0,2025-10-02T11:42:08+00:00
1123862640,"Holterberg herfst","De herfst is weer in aantocht. Sommigen bramen hangen nog aan de struik. De gekleurde bladeren zijn al weer op te merken.",57,https://player.vimeo.com/video/1123862640?h=45c4bcabbd&title=0&byline=0&portrait=0&badge=0&autopause=0&player_id=0&app_id=58479,https://i.vimeocdn.com/video/2065576123-b76b781f04fcec98652f037b06b02dd3f5d89bb3d9181f611611d3f41a7437af-d_1920x1080?&r=pad&region=us,"Herfst, Gemeente Rijssen Holten, Provincie Overijssel","",Overijssel,Rijssen Holten,"",0,2025-10-02T11:32:24+00:00
1123861438,"Holterberg herfst","De herfst is begonnen. Er hangen nog wat bramen aan de struik. De gekleurde bladeren aan de bomen melden zich al weer.",23,https://player.vimeo.com/video/1123861438?h=e8444ce8cc&title=0&byline=0&portrait=0&badge=0&autopause=0&player_id=0&app_id=58479,https://i.vimeocdn.com/video/2065573863-cf0925fdae65c47859dc0fde288e1dcd9c69f292276bbe898cdc91fbe0ead9de-d_1920x1080?&r=pad&region=us,"herfst, Gemeente Rijssen Holten, Provincie Overijssel","",Overijssel,Rijssen Holten,"",0,2025-10-02T11:27:39+00:00
1123860477,"Nazomer Sallandse Heuvelrug Nijverdal blauwe route","Een nazomerse dag in het bos en op de hei. Drink je een kopje koffie mee?",18,https://player.vimeo.com/video/1123860477?h=fa1d3797ec&title=0&byline=0&portrait=0&badge=0&autopause=0&player_id=0&app_id=58479,https://i.vimeocdn.com/video/2065572681-88c2b964203058cf707c4d2c8197fea0f2c4c3f787495be6c611e57949adeabd-d_1920x1080?&r=pad&region=us,"koffie, heide, zomer, Gemeente Hellendoorn, Provincie Overijssel","",Overijssel,Hellendoorn,"",0,2025-10-02T11:23:31+00:00
1123858868,"Haaksbergen Buurseveld winter","Geniet van het mooie Buurseveld. Wat een prachtige heide en mooie eiken staan hier toch. Dit is de lange versie van de opname.",36,https://player.vimeo.com/video/1123858868?h=1e430920c5&title=0&byline=0&portrait=0&badge=0&autopause=0&player_id=0&app_id=58479,https://i.vimeocdn.com/video/2065571103-992b26f831973959879321dde583e12812339aa392f33a005ad37e0d140c2109-d_1920x1080?&r=pad&region=us,"water, ijs, heide, winter, Buurse, Gemeente Haaksbergen, Provincie Overijssel","",Overijssel,Haaksbergen,"",0,2025-10-02T11:17:10+00:00
1123855816,"Landgoed Den Berg Dalfsen lente","Een rondje rondom landgoed Den Berg in Dalfsen.",15,https://player.vimeo.com/video/1123855816?h=b6101fc348&title=0&byline=0&portrait=0&badge=0&autopause=0&player_id=0&app_id=58479,https://i.vimeocdn.com/video/2065566947-07aa5810b5fcc33a7fdebed3ca8cabdbd4182b4e6e216d30464265bd9ef93fc6-d_1920x1080?&r=pad&region=us,"Gemeente Dalfsen, Provincie Overijssel","",Overijssel,Dalfsen,"",0,2025-10-02T11:04:42+00:00
1123855106,"Dalfsen Landgoed Aalshorst Lenteavond","Een avondwandeling in de lente rond Landgoed Aalshorst. Dit is de korte versie van deze opname.",16,https://player.vimeo.com/video/1123855106?h=b7d570edb4&title=0&byline=0&portrait=0&badge=0&autopause=0&player_id=0&app_id=58479,https://i.vimeocdn.com/video/2065566213-1522f94631f5ce68eaad9cd636143c470bf150b6d4e68545b50023ff7c48af8c-d_1920x1080?&r=pad&region=us,"krentenboom, Lente, Gemeente Dalfsen, Provincie Overijssel","",Overijssel,Dalfsen,"",0,2025-10-02T11:01:35+00:00
1123854968,"25 Gemeente Dalfsen, Dalfsen Landgoed Aalshorst Lenteavond KORT","",0,https://player.vimeo.com/video/1123854968?h=be9bdc079a&title=0&byline=0&portrait=0&badge=0&autopause=0&player_id=0&app_id=58479,https://i.vimeocdn.com/video/default-2308240_1920x1080?&region=us,"","",,,"",0,2025-10-02T11:01:00+00:00
1123854126,"Dalfsen Landgoed Aalshorst Lenteavond","Een avondwandeling in de lente rond Landgoed Aalshorst. Dit is de lange versie van deze opname.",25,https://player.vimeo.com/video/1123854126?h=12335ffa1c&title=0&byline=0&portrait=0&badge=0&autopause=0&player_id=0&app_id=58479,https://i.vimeocdn.com/video/2065565438-cc418c7a318c99c4e0e3ab97048b2aad5f90652f28605b4de80dbe6451d9e4f4-d_1920x1080?&r=pad&region=us,"krentenboom, Lente, Gemeente Dalfsen, Provincie Overijssel","",Overijssel,Dalfsen,"",0,2025-10-02T10:57:21+00:00
1123851128,"Hancate Vistrappen Regge Lente Vensterbankies route","Een mooie avondwandeling langs de Regge. Je ziet dat het lente is, want er zijn mooie lentebloeiers langs de route. En: als je goed kijkt zie je aan het einde van de wandeling en de verte de bloedmaan",22,https://player.vimeo.com/video/1123851128?h=87b3c2c5b3&title=0&byline=0&portrait=0&badge=0&autopause=0&player_id=0&app_id=58479,https://i.vimeocdn.com/video/2065561592-0025a1f1b1b8d73930864f1e4cf7f150d28637a637e670f5abb03a49b30d8d41-d_1920x1080?&r=pad&region=us,"bloedmaan, lentebloeiers, vistrappen, ondergaande zon, Avondzon, Lente, water, Regge, ganzen, Gemeente Hellendoorn, Provincie Overijssel","",Overijssel,Hellendoorn,"",0,2025-10-02T10:45:19+00:00
1123846274,"Hancate vistrappen Regge Lente Vensterbankies route","Een mooie avondwandeling langs de Regge. Je ziet dat het lente is, want er zijn mooie lentebloeiers langs de route. En: als je goed kijkt zie je aan het einde van de wandeling en de verte de bloedmaan",32,https://player.vimeo.com/video/1123846274?h=1b30776f1c&title=0&byline=0&portrait=0&badge=0&autopause=0&player_id=0&app_id=58479,https://i.vimeocdn.com/video/2065555323-a74d01a1dd9999ed34e1d9ae5dcaec97a9eb2f39bea2e463f26421397a294fdd-d_1920x1080?&r=pad&region=us,"vistrap, zonsondergang, bloedmaan, rivier, water, Gemeente Hellendoorn, Provincie Overijssel, avondzon, ganzen","",Overijssel,Hellendoorn,"",0,2025-10-02T10:25:17+00:00
1123845168,"Den Haag Kijkduin lente","Eventjes kort het strand op, gewoon: omdat het kan! Er liggen genoeg kwallen op het strand.",7,https://player.vimeo.com/video/1123845168?h=fcfc512277&title=0&byline=0&portrait=0&badge=0&autopause=0&player_id=0&app_id=58479,https://i.vimeocdn.com/video/2065553410-54b4c2c27247f91a73d9339615ccbd673bac1b390608e8532da52c0b45b52980-d_1920x1080?&r=pad&region=us,"kwallen, Strand, Kijkduin, Gemeente Den Haag, Provincie Noord Holland","",Noord Holland,Den Haag,"",0,2025-10-02T10:20:31+00:00
1123844259,"Gemeente Dalfsen Groene Route Lente","Een mooie route langs de weilanden en door de bossen. We starten bij station Dalfsen. Dit is de korte versie van deze route.",22,https://player.vimeo.com/video/1123844259?h=645034899e&title=0&byline=0&portrait=0&badge=0&autopause=0&player_id=0&app_id=58479,https://i.vimeocdn.com/video/2065552988-460d9d96dcb3df086f71de395aeaa4635db72d2bd59912b3b3423a59e1af63d7-d_1920x1080?&r=pad&region=us,"weide, vogels, lente, gemeente Dalfsen, Provincie Overijssel","",Overijssel,Dalfsen,"",0,2025-10-02T10:16:34+00:00
1123842906,"Groene Route vanaf Dalfsen Station Lente","Lekker door het bos en langs de weilanden. We komen nog langs Landgoed Den Berg. Dit is de lange versie van de route.",43,https://player.vimeo.com/video/1123842906?h=50eecc1b8a&title=0&byline=0&portrait=0&badge=0&autopause=0&player_id=0&app_id=58479,https://i.vimeocdn.com/video/2065551488-36d0b00e70099608605dc26af736574d5c660b83fa99576b05ba9fa38ce8f526-d_1920x1080?&r=pad&region=us,"vogels, bos, Gemeente Dalfsen, Provincie Overijssel","",Overijssel,Dalfsen,"",0,2025-10-02T10:10:37+00:00
1123842137,"Dalfsen Park Bellingeweer","Een mooi rondje door het park, zie jij ook de libellen?",11,https://player.vimeo.com/video/1123842137?h=6758297932&title=0&byline=0&portrait=0&badge=0&autopause=0&player_id=0&app_id=58479,https://i.vimeocdn.com/video/2065549868-a6c6d00a723de90fbcc58dd4cd87586286399542db576cd6fb2884c46f17d4b2-d_1920x1080?&r=pad&region=us,"Libellen, Gemeente Dalfsen, Provincie Overijssel","",Overijssel,Dalfsen,"",0,2025-10-02T10:07:21+00:00
1123841097,"Landgoed Twickel Lente","",21,https://player.vimeo.com/video/1123841097?h=7ca8e7c007&title=0&byline=0&portrait=0&badge=0&autopause=0&player_id=0&app_id=58479,https://i.vimeocdn.com/video/2065548909-0726cd0b859dd68d3551d07ba67df2912d139351f6c560e80567c409683bbdb9-d_1920x1080?&r=pad&region=us,"schapen, molen, kikkers, vogels, vlonderpad, Twickel, Gemeente Hof van Twente, Provincie Overijssel","",Overijssel,Hof van Twente,"",0,2025-10-02T10:03:27+00:00
1123839748,"Landgoed Twickel Vlonderpad Lente","Een heerlijke lentewandeling langs de weilanden, door het bos en moeras, over het vlonderpad. En waar kom je daarna? Bij de Noordermolen om daarna je pad weer te vervolgen door het bos en langs de wei",38,https://player.vimeo.com/video/1123839748?h=61592343fe&title=0&byline=0&portrait=0&badge=0&autopause=0&player_id=0&app_id=58479,https://i.vimeocdn.com/video/2065547798-4728a714bb0c9f59f5e069d6963ff2e8ab3075788828cd0ca29f9d6ea51e9269-d_1920x1080?&r=pad&region=us,"schapen, moeras, weide, vlinder, vogels, vlonderpad, lente, Twickel, Gemeente Hof van Twente, Provincie Overijssel","",Overijssel,Hof van Twente,"",0,2025-10-02T09:57:54+00:00
1123837047,"Landgoed Twickel Lente","Eventjes een kort inkijkje bij het kasteel, de volkstuinen en zicht op de watertoren.",5,https://player.vimeo.com/video/1123837047?h=5766de89d0&title=0&byline=0&portrait=0&badge=0&autopause=0&player_id=0&app_id=58479,https://i.vimeocdn.com/video/2065543684-e181f64c8425cfc0b846a4d824fbb59eab7162020af84622f009aeb09a2be890-d_1920x1080?&r=pad&region=us,"kikkers, Kasteel, Twickel, Gemeente Hof van Twente, Provincie Overijssel","",Overijssel,Hof van Twente,"",0,2025-10-02T09:47:09+00:00
1123827941,"Lemelerberg Zonnebloemweg Lente","Geniet van deze lentewandeling op de Lemelerberg. Dit is de korte versie van deze route.",22,https://player.vimeo.com/video/1123827941?h=decdd23fd4&title=0&byline=0&portrait=0&badge=0&autopause=0&player_id=0&app_id=58479,https://i.vimeocdn.com/video/2065533558-7380c752f8c91b9d5ae4148deaa956b0c166b6b6c6b9e2306130b97607984638-d_1920x1080?&r=pad&region=us,"lente, gemeente ommen, provincie overijssel","",overijssel,ommen,"",0,2025-10-02T09:10:36+00:00
1123821791,"Lemelerberg Zonnebloemweg Lente","Een heidewandeling op de Lemelerberg. Dit is de lange versie van deze route.",45,https://player.vimeo.com/video/1123821791?h=446adc9a80&title=0&byline=0&portrait=0&badge=0&autopause=0&player_id=0&app_id=58479,https://i.vimeocdn.com/video/2065526185-c9007f89d9b6de3c572d32080961eff5ad0d3d5228965c636418d3e0a5e3be4c-d_1920x1080?&r=pad&region=us,"Lemele, Lente, Gemeente Ommen, Provincie Overijssel","",Overijssel,Ommen,"",0,2025-10-02T08:43:35+00:00
1123153991,"Den Ham: zomer boeren landschappen","Geniet van deze zomerse wandeling om en in het dorp. Langs de weilanden en het water. Dit is de korte versie van deze route.",22,https://player.vimeo.com/video/1123153991?h=53cf60aa9a&title=0&byline=0&portrait=0&badge=0&autopause=0&player_id=0&app_id=58479,https://i.vimeocdn.com/video/2064723910-0eef212e770b9775922cc595decdbcf42596ac4c8e8c3624ff0985024dec7b9d-d_1920x1080?&r=pad&region=us,"water, hooi, Den Ham, gemeente Twenterand, Provincie Overijssel","",Overijssel,Twenterand,"",0,2025-09-30T10:16:16+00:00
1123143097,"Den Ham: zomer ochtend boeren landschappen","",42,https://player.vimeo.com/video/1123143097?h=9cc778b545&title=0&byline=0&portrait=0&badge=0&autopause=0&player_id=0&app_id=58479,https://i.vimeocdn.com/video/2064711598-41cff024a74f6798f0608bda0d5168bd5c7746215a13d77babc3a52b705b32c6-d_1920x1080?&r=pad&region=us,"weide, Den Ham, Gemeente Twenterand, Provincie Overijssel","",Overijssel,Twenterand,"",0,2025-09-30T09:34:58+00:00
1123141730,"34 Gemeente Raalte Laag Zuthem Landgoederen Den Alerdinck en de Colckhof zomer ochtend KORT","",23,https://player.vimeo.com/video/1123141730?h=c511bec706&title=0&byline=0&portrait=0&badge=0&autopause=0&player_id=0&app_id=58479,https://i.vimeocdn.com/video/2064709434-97a4c194a2daff2c72db99789cd0b28b411d977b3facc63c192a105c337df9b1-d_1920x1080?&r=pad&region=us,"","",,,"",0,2025-09-30T09:29:28+00:00
1123140409,"Laag Zuthem: Landgoederen Den Alerdinck en de Colckhof Zomer","Loop langs deze prachtige landgoederen tijdens deze mooie zomerochtend. Dit is de lange versie van deze opname.",39,https://player.vimeo.com/video/1123140409?h=9c483e8de6&title=0&byline=0&portrait=0&badge=0&autopause=0&player_id=0&app_id=58479,https://i.vimeocdn.com/video/2064708381-0e1f71c1a4c8b56c5a0db64e2ebbd200c5ea7222b09c6ac5f3de3b2645338f92-d_1920x1080?&r=pad&region=us,"weide, zonnestralen, Zomer, Laag Zuthem, Gemeente Raalte, Provincie Overijssel","",Overijssel,Raalte,"",0,2025-09-30T09:24:20+00:00
1123138928,"Nijverdalse berg: groene route zomer","Een bewolkte zomerse dag op de Nijverdalse berg. We lopen door het bos, over de hei en langs de schaapskudde bij Schaapskooi Twilhaar. Dit is de korte versie van deze opname. Geniet er van!",23,https://player.vimeo.com/video/1123138928?h=8e8e40ff0f&title=0&byline=0&portrait=0&badge=0&autopause=0&player_id=0&app_id=58479,https://i.vimeocdn.com/video/2064706112-2c4975b5fa02f0358e0a3915a8d93060994958336fbd3c3495dfc34e19a4a387-d_1920x1080?&r=pad&region=us,"wind, schapen, heide, Bos, Nijverdal, Gemeente Hellendoorn, Provincie Overijssel","",Overijssel,Hellendoorn,"",0,2025-09-30T09:18:41+00:00
1123137556,"Nijverdalse berg: groene route zomer","Een bewolkte zomerse dag door het bos en over de heide. Loop ook nog even langs de schaapskudde bij Schaapskooi Twilhaar.",39,https://player.vimeo.com/video/1123137556?h=bd2afe54a5&title=0&byline=0&portrait=0&badge=0&autopause=0&player_id=0&app_id=58479,https://i.vimeocdn.com/video/2064704872-cf7a817f253289660425cc2292a0c3c2353e2ea8daa3038bc63a38e6c9e159c6-d_1920x1080?&r=pad&region=us,"schapen, bos, heide, bosbessen, Provincie Overijssel, Gemeente Hellendoorn","",Overijssel,Hellendoorn,"",0,2025-09-30T09:13:03+00:00
1123135340,"Hellendoorn: Landgoed Eelerberg rondje pinetum zomer","Bekijk alle mooie bomen van het Pinetum tijdens deze fijne zomer ochtend!",19,https://player.vimeo.com/video/1123135340?h=d7d9750a5d&title=0&byline=0&portrait=0&badge=0&autopause=0&player_id=0&app_id=58479,https://i.vimeocdn.com/video/2064701625-0366e49db99a77d25052dfd1e4f00a03ae3b3f7b6c4499ed5061c40b83677ead-d_1920x1080?&r=pad&region=us,"Zomer, Gemeente Hellendoorn, Provincie Overijssel","",Overijssel,Hellendoorn,"",0,2025-09-30T09:04:51+00:00
1123134607,"Hellendoorn: Eelerberg rode route zomer","Ga lekker op pad tijdens deze lekkere ochtendwandeling op de Eelerberg. De zonnestralen komen je tegemoet.",18,https://player.vimeo.com/video/1123134607?h=ab295a6d9e&title=0&byline=0&portrait=0&badge=0&autopause=0&player_id=0&app_id=58479,https://i.vimeocdn.com/video/2064700797-e9640f04863b99695c31a054dea699a79934cdab044f3498ae08033ffbad1bb8-d_1920x1080?&r=pad&region=us,"zonnestralen, bos, gemeente Hellendoorn, Provincie Overijssel","",Overijssel,Hellendoorn,"",0,2025-09-30T09:02:12+00:00
1123132550,"Diepenveen: oranje rondje om het dorp","Langs het kerkenpad, velden, parkbossen en wateren zoals de Zandwetering en de Molenkolk. Dit is de korte versie van de route.",23,https://player.vimeo.com/video/1123132550?h=ab3e3389c0&title=0&byline=0&portrait=0&badge=0&autopause=0&player_id=0&app_id=58479,https://i.vimeocdn.com/video/2064698420-8c1327a718c085a9ab8912fb9b08d42c15dc96508adea318f86c850dcd0e626c-d_1920x1080?&r=pad&region=us,"bos, water, Gemeente Deventer, Provincie Overijssel","",Overijssel,Deventer,"",0,2025-09-30T08:53:27+00:00
1123129781,"Diepenveen: Oranje rondje om het dorp","Dit rondje loop je langs het kerkenpad, velden, parkbossen en wateren zoals de Zandwetering en de Molenkolk. Een mooi zomers rondje!",37,https://player.vimeo.com/video/1123129781?h=c2b8924526&title=0&byline=0&portrait=0&badge=0&autopause=0&player_id=0&app_id=58479,https://i.vimeocdn.com/video/2064695926-66528839dd136de33eaa18708e794104c20514dd6099cf0f541bc7ed047a0481-d_1920x1080?&r=pad&region=us,"water, bos, Gemeente Deventer, Provincie Overijssel","",Overijssel,Deventer,"",0,2025-09-30T08:41:52+00:00
1123119434,"Diepenveen: Klooster Nieuw Sion Pelgrimtocht Zomer","Een mooie ronde bij het voormalig Klooster Abdei Sion. Geniet van deze zomer wandeling!",22,https://player.vimeo.com/video/1123119434?h=1423a47819&title=0&byline=0&portrait=0&badge=0&autopause=0&player_id=0&app_id=58479,https://i.vimeocdn.com/video/2064683280-35d93b344a5c195109be601898c832da4d16d372fa4d9381537cac0851e9691e-d_1920x1080?&r=pad&region=us,"Krekels, Zomer, Gemeente Deventer, Provincie Overijssel","",Overijssel,Deventer,"",0,2025-09-30T07:59:04+00:00
1123114957,"Diepenveen: Klooster Nieuw Sion Pelgrimtocht","Een rondje in de zomer bij het voormalig Abdei Sion.",41,https://player.vimeo.com/video/1123114957?h=74a115585e&title=0&byline=0&portrait=0&badge=0&autopause=0&player_id=0&app_id=58479,https://i.vimeocdn.com/video/2064678887-8d113e01b755afe90f785220196cc3f28a4eab56645f8f96d7a5dbf0c88e9566-d_1920x1080?&r=pad&region=us,"krekels, bos, zomer, Gemeente Deventer, Provincie Overijssel","",Overijssel,Deventer,"",0,2025-09-30T07:39:02+00:00
1123108426,"Lemelerberg Zomer: De leeuw, dikke steen & hoogste punt","Geniet van deze ochtendwandeling op de Lemelerberg in de zomer. De heide staat vol in bloei! Dit is de korte versie van deze route.",23,https://player.vimeo.com/video/1123108426?h=a83227f50d&title=0&byline=0&portrait=0&badge=0&autopause=0&player_id=0&app_id=58479,https://i.vimeocdn.com/video/2064669546-86ce70b67fe3a9c1549b309e7c41e421cf84233ffe8a115156d5e3bdb2bcb125-d_1920x1080?&r=pad&region=us,"Overijssel, Gemeente Ommen, zomer, heide","",,Ommen,"",0,2025-09-30T07:11:05+00:00
1123107437,"Lemelerberg: Zomer: De leeuw, dikke steen & hoogste punt","Loop mee op de |emelerberg met de prachtige bloeiende heide tijdens deze vroege ochtend wandeling in de zomer Lange versie van deze opname..",41,https://player.vimeo.com/video/1123107437?h=13674f335f&title=0&byline=0&portrait=0&badge=0&autopause=0&player_id=0&app_id=58479,https://i.vimeocdn.com/video/2064668749-72b477b0a4ba9f9c5736d6eb2e1130c5ad1627964fde0742d21772b06918bb59-d_1920x1080?&r=pad&region=us,"Zonsopkomst, Heide, Zomer","",,,"",0,2025-09-30T07:05:46+00:00
1123107209,"41 Lemelerberg 01 de leeuw dikke steen hoogste punt zomer_LANG","",0,https://player.vimeo.com/video/1123107209?h=54b505027f&title=0&byline=0&portrait=0&badge=0&autopause=0&player_id=0&app_id=58479,https://i.vimeocdn.com/video/default-2308240_1920x1080?&region=us,"","",,,"",0,2025-09-30T07:04:44+00:00
1123107147,"41 Lemelerberg 01 de leeuw dikke steen hoogste punt zomer_LANG","",0,https://player.vimeo.com/video/1123107147?h=3053f4faf5&title=0&byline=0&portrait=0&badge=0&autopause=0&player_id=0&app_id=58479,https://i.vimeocdn.com/video/default-2308240_1920x1080?&region=us,"","",,,"",0,2025-09-30T07:04:28+00:00
1123106775,"Lemelerberg De leeuw Dikke steen & Hoogste punt Zomer","",23,https://player.vimeo.com/video/1123106775?h=79fe97cfca&title=0&byline=0&portrait=0&badge=0&autopause=0&player_id=0&app_id=58479,https://i.vimeocdn.com/video/2064667445-43f1ce22e45a85bceeee45af5fbc7d7458bdcb03bca6797d34474ca587733039-d_1920x1080?&r=pad&region=us,"","",,,"",1,2025-09-30T07:02:36+00:00
1120843852,"Holterberg, Holten herfst","Een herfstroute die start boven op de Holterberg. We maken een rondje.",23,https://player.vimeo.com/video/1120843852?h=fdcef7bd65&title=0&byline=0&portrait=0&badge=0&autopause=0&player_id=0&app_id=58479,https://i.vimeocdn.com/video/2061728876-43d7447479bc8f410d4df4638207e5722eb8427ecb0f26ac39c968b1c74703d0-d_1920x1080?&r=pad&region=us,"","",,,"",0,2025-09-22T14:02:04+00:00
1120843449,"3. Holterberg, holten Lang","",0,https://player.vimeo.com/video/1120843449?h=2743c11f70&title=0&byline=0&portrait=0&badge=0&autopause=0&player_id=0&app_id=58479,https://i.vimeocdn.com/video/default-2308240_1920x1080?&region=us,"","",,,"",0,2025-09-22T14:01:03+00:00
1120843045,"Holterberg, Holten korte route","",23,https://player.vimeo.com/video/1120843045?h=62d99e3c9c&title=0&byline=0&portrait=0&badge=0&autopause=0&player_id=0&app_id=58479,https://i.vimeocdn.com/video/2061727729-c6ce745de5c22198bd5f889b913c7fa51336a3b9d89b7b5cbe35b01ed0375440-d_1920x1080?&r=pad&region=us,"","",,,"",0,2025-09-22T14:00:08+00:00
1119710317,"2. haarlerberg Lang","",0,https://player.vimeo.com/video/1119710317?h=37d9e1d5d7&title=0&byline=0&portrait=0&badge=0&autopause=0&player_id=0&app_id=58479,https://i.vimeocdn.com/video/default-2308240_1920x1080?&region=us,"","",,,"",0,2025-09-18T08:37:03+00:00
